commit	abs_rel	rmse	d1	memory_gb	status	description
93ef41b	0.3234	1.4526	0.5945	17.0	confirm	E144 [S22 confirm] rerun of E143 multi-res+coherence 11ch: 0.3234/1.4526/0.5945 comp 2.0320. With E143 2.0447 -> 2-draw mean 2.038, BOTH far below champion multi-res best draw 2.0595 (Delta -0.026 vs mean 2.064). Consistent HONEST-metric gains: RMSE ~1.455 (< champ 1.4645), d1 ~0.593 (> 0.588). Coherence (direct-vs-diffuse) STRONG replicated win. 3rd draw E145 queued before crowning.
93ef41b	0.3283	1.4585	0.5903	17.0	keep	E145 [S22 3rd draw -> CROWN] multi-res+coherence 11ch: 0.3283/1.4585/0.5903 comp 2.0485. 3-draw {2.0447,2.0320,2.0485} mean 2.0417 std 0.007 vs old champion multi-res 2.064 -> Delta -0.022, ALL below old champion best draw 2.0595. Coherence (direct-vs-diffuse) improves HONEST RMSE+d1. NEW GLOBAL CHAMPION: multi-res STFT 512+128 + interaural coherence(512), in_ch=11, commit 93ef41b. S22 PASS.
36c6538	0.3268	1.4513	0.5967	17.0	keep	E146 [S23 refine] coherence at BOTH scales (512+128 -> 12ch): 0.3268/1.4513/0.5967 comp 2.0289 vs champion 11ch (coh 512) 3-draw mean 2.042 -> Delta -0.013 (but only -0.003 vs champion best draw 2.0320). BEST-EVER honest metrics (RMSE 1.4513, d1 0.5967). Promising but thin margin vs best draw + adds a channel -> confirmation rerun E147 before crowning.
36c6538	0.3282	1.4538	0.5962	17.0	confirm	E147 [S23 confirm] rerun of E146 coherence-both-scales 12ch: 0.3282/1.4538/0.5962 comp 2.0325. With E146 2.0289 -> 2-draw mean 2.0307. BOTH 12ch draws <= 11ch champion best draw 2.0320; 2-draw mean 0.011 below 11ch 3-draw mean 2.042 (but 11ch mean rests on 2 higher draws). Borderline -> 3rd draw E148 for a fair 3-vs-3 comparison before crowning.
36c6538	0.3266	1.4523	0.5971	17.0	keep	E148 [S23 3rd draw -> CROWN] 12ch coherence-both-scales (512+128): 0.3266/1.4523/0.5971 comp 2.0285. 12ch 3-draw {2.0289,2.0325,2.0285} mean 2.0300 std 0.0018 (tight) vs 11ch champion 2.042 -> Delta -0.012 (clears noise), ALL below 11ch best draw 2.0320. Best-ever RMSE 1.4513/d1 0.597. Fine-scale (128) coherence adds complementary direct-vs-diffuse structure. NEW GLOBAL CHAMPION: 12ch, commit 36c6538. S23 PASS.
2aa0ba8	0.3239	1.4514	0.5998	17.0	keep	E149 [S24 tune] coherence smooth taps 3->5: 0.3239/1.4514/0.5998 comp 2.0201 vs champion smooth=3 3-draw mean 2.030 (draws 2.0285-2.0325 std 0.0018) -> Delta -0.010, 0.008 below champion best draw. Best-ever d1 0.5998 (~0.60) + RMSE 1.4514. smooth=5 -> more stable coherence estimate = real gain, NO added complexity (same 12ch). PROVISIONAL; confirmation rerun E150.
2aa0ba8	0.3249	1.4568	0.5930	17.0	discard	E150 [S24 confirm] rerun of E149 coherence smooth=5: 0.3249/1.4568/0.5930 comp 2.0389. With E149 2.0201 -> smooth=5 2-draw mean 2.0295 =~ champion smooth=3 2.030 (draws STRADDLE it: E149 2.0201 below, E150 2.0389 above the champion tight range 2.0285-2.0325). smooth=5 NEUTRAL (E149 was a lucky low draw). Smoothing taps not a lever. Keep smooth=3 champion 36c6538. S24 concluded neutral.
a76236d	0.3233	1.4707	0.5866	17.1	discard	E151 [S25 new] 3rd coherence scale n_fft=1024 -> 13ch: 0.3233/1.4707/0.5866 comp 2.0603 vs champion 12ch (coh 512+128) 2.030 -> +0.030 WORSE. The 1024 window (~21ms) over the ~59ms cut gives only ~3-4 STFT frames -> noisy/degenerate coherence that DILUTES the input; also 13ch slower -> 8 epochs (under-anneal). Coherence SATURATED at 2 scales (512,128). Keep 12ch champion 36c6538.
0d4fe13	0.3261	1.4619	0.5910	17.1	discard	E152 [S26 new] onset/direct-arrival channel -> 13ch: 0.3261/1.4619/0.5910 comp 2.0475 vs champion 12ch 2.030 -> +0.018 WORSE (9 epochs, NOT under-annealed). Onset (log-mag above local temporal baseline) REDUNDANT/harmful: the conv encoder already captures onset/transient structure from the mag channels; extra channel dilutes. 3rd consecutive representation plateau (S24 smooth, S25 3rd-coh, S26 onset) -> acoustic-representation-v2 axis at CEILING. Keep 12ch champion 36c6538 as final method.
36c6538	0.3284	1.4482	0.5953	17.0	confirm	E153 [S27 confirm] 4th champion draw (12ch): 0.3284/1.4482/0.5953 comp 2.0311 (best-ever RMSE 1.4482). 12ch 4-draw {2.0289,2.0325,2.0285,2.0311} mean 2.0303 std 0.0016 -> champion rock-solid. Both research axes mapped; 2.030 is the settled final method.
0129f2a	0.3233	1.4771	0.5886	18.1	discard	E155 [S29 new PROPOSAL-02] learned STFT front-end (raw_fe=8, 12ch+8learned->20ch): 0.3233/1.4771/0.5886 comp 2.0600 vs champion 2.030 -> +0.030 WORSE, 8 epochs (extra native STFT slower). Failure modes: (1) 8 RANDOM-init front-end channels dilute the input, encoder must learn use/ignore in 8 epochs; (2) epoch penalty. Refine E156 = ZERO-INIT front-end last conv so model starts == champion and adds features only if useful (fair additive test).
